File Number,First Name:Principal Author,Last Name:Principal Author,Institution of Principal Author:Principal Author,Co Authors: Ê:Principal Author,White Paper Title,White Paper Description (350 character limit),File Link Ê1,Faisal,Hossain,University of Washington,"Aleix Serrat-Capdevila, Stephanie Granger, Amy Thomas, David Saah, David Ganz, Robinson Mugo, MSR Murthy, Victor Hugo Ramos, Eric Anderson, Guy Schumann, Rebecca Lewison, Dalia Kirschbaum, Vanessa Escobar, Margaret Srinivasan, Christine Lee, Naveed Iqbal, Elliot Levine, Nancy Searby, Lawrence Friedl, Africa Flores, Dauna Coulter, Carolyn Fonseca, Dan Irwin, Ashutosh Limaye, Tim Stough, Jay Skiles, Sue Estes, Bill Crosson, Ali S. Akanda.",INPUT TO NRC DECADAL SURVEY ON GLOBAL CAPACITY BUILDING AND APPLICATIONS FOR SOCIAL GOOD USING SATELLITE EARTH OBSERVATIONS,This white paper represents the current view of the global capacity building and applications community of satellite earth  observations to achieve social good. It outlines key question and urgent needs for the coming decade.,http://surveygizmoresponseuploads.s3.amazonaws.com/fileuploads/15647/2289356/36-5ec1699ffb0bea8fea4674cdd39f06be_NRC+input+for+DS+for+Global+Capacity+Building+-E2workshopTacoma-1.docx2,Faisal,Hossain,University of Washington,"Aleix Serrat-Capdevila, Stephanie Granger, Amy Thomas, David Saah, David Ganz, Robinson Mugo, MSR Murthy, Victor Hugo Ramos, Eric Anderson, Guy Schumann, Rebecca Lewison, Dalia Kirschbaum, Vanessa Escobar, Margaret Srinivasan, Christine Lee, Naveed Iqbal, Elliot Levine, Nancy Searby, Lawrence Friedl, Africa Flores, Dauna Coulter, Carolyn Fonseca, Dan Irwin, Ashutosh Limaye, Tim Stough, Jay Skiles, Sue Estes, Bill Crosson, Ali S. Akanda.",Community-derived Graphics as Vision and Mission Statements for Applications and Capacity Building using Satellite Earth Observations,This white paper describes the recent effor by th ecommunity on global capacity building (of satellite earth observations) to capture graphics that explain holistically how the next decade of multi-platform observations should be used.,http://surveygizmoresponseuploads.s3.amazonaws.com/fileuploads/15647/2289356/246-fb70bb1436a11a335e5a419099ef3fda_NRC+input+for+DS+for+Global+Capacity+Building+-E2workshopTacoma-2.docx3,Allen,Pope,National Snow and Ice Data Center,"Penelople Wagner, Robert Johnson, Jamie Shutler, Jenny Baeseman, Louise Newman",Community Review of Southern Ocean Satellite Data Needs,"Through widespread engagement of over 100 individuals (both research and operational), this white paper represents a brief summary of the Southern Ocean communityÕs satellite data needs for the coming decade. The full report is available as a forthcoming publication, which should be consulted rather than this white paper, if possible.",http://surveygizmoresponseuploads.s3.amazonaws.com/fileuploads/15647/2289356/66-ed5bf38d14fb85f2e22a922b454a37de_PopeAllenJ.docx4,Bing,Lin,NASA Langley Research Center,"Yongxiang Hu, Nathanael Miller",Global Surface Dry Air Pressure Measurements from Space for Greenhouse Gas Volume Mixing Ratio Observations,"Air pressure is an important variable in calculations of atmospheric dynamics and also essential for greenhouse gas volume mixing ratio estimations. Currently, it can only be observed by in-situ measurements in very-limited places. Thus, there is an urgent need to observe global surface air pressure from space for GHG besides severe weathers.",http://surveygizmoresponseuploads.s3.amazonaws.com/fileuploads/15647/2289356/66-311b4897aeaed5e722c8cba53e80b205_LinBing.pdf5,Henry,Revercomb,"University of Wisconsin-Madison, Space Science and Engineering Center","William L. Smith, W. Paul Menzel, Timothy J. Schmit, Mitch Goldberg, Ralph Petersen, Jun Li, David C. Tobin, Robert O. Knuteson, Joe K. Taylor, Steven A. Ackerman, Jeffrey R. Key, Dave Santek,  Jordan Gerth, Grant W. Petty, Gregory J. Tripoli, Tristan L'Ecuyer, Robert Rabin, William D. Collins, Martin G. Mlynczak, Henry Buijs",Advanced geostationary sounders are needed to significantly enhance capabilities for issuing crucial pre-storm warnings,"A key challenge for operational weather forecasting is making timely, credible, location-specific, severe weather warnings. This challenge can be met using data from advanced IR imaging sounders in geostationary orbit, and should be vigorously pursued via a NASA pathfinder mission. The 2017 Decadal Survey should give this a very high priority.",http://surveygizmoresponseuploads.s3.amazonaws.com/fileuploads/15647/2289356/246-11ef4f1e6bc21bb3ed04a4c80810555e_RevercombHenryE2.docx6,Henry,Revercomb,"University of Wisconsin-Madison, Space Science and Engineering Center","Jim Anderson, Bruce A. Wielicki, Stephen Leroy, Fred A. Best, David C. Tobin, Robert O. Knuteson, Joe K. Taylor, William L. Smith, Jonathan Gero, Nadia Smith, Henry Buijs, Frederic J. Grandmont, John Dykema, Martin G. Mlynczak, David G. Johnson, Peter Pilewskie, Greg Kopp, William D. Collins, Daniel Feldman, Brian Soden, Steven A. Ackerman",An observatory to establish a global benchmark of the current climate from space  is crucial to advancing accurate decadal climate forecasting,Implementing an observatory to establish a global benchmark of the current climate from space should be a very high priority of the next decade. The NASA CLARREO program has provided the scientific and technical foundation that demonstrates readiness for this key mission.   A strong recommendation to proceed expeditiously with execution is needed.,http://surveygizmoresponseuploads.s3.amazonaws.com/fileuploads/15647/2289356/36-6930f6f7a0f69786404368ab4d400326_RevercombHenryE1.docx7,Kenneth,Jezek,The Ohio State University,"J. Johnson, M. Durand, C. Chen, G. Macelloni, M. Brogioni","Low-Frequency, Multi-channel Microwave Radiometry for  Cryospheric Monitoring","This white-paper introduces a new concept of low-frequency, multi-channel microwave radiometry to measure sub-surface temperature and other physical properties of ice sheets, sea ice, permafrost, and seasonal snow cover.  The system can also provide advantages in the measurement of sub-surface soil moisture and vegetation biomass.",http://surveygizmoresponseuploads.s3.amazonaws.com/fileuploads/15647/2289356/36-82651d541063426fae86dec0f13f1c4d_JezekKennethC.pdf8,Tong,Lee,"Jet Propulsion Laboratory, California Institute of Technology","Aida Alvera Azcarate, Chris Bank, Eric Bayler, Fred Bingham, Jacqueline Boutin, Frank Bryan, Subrahmanyam Bulusu, Jim Carton, Kyla Drushka, Paul Durack, Rana Fine, Christine Gommenginger, Arnold Gordon, Seymon Grodsky, Eric Hackert, Johhny Johannessen, Nicolas Kolodziejczyk, Armind Kšhl, Gary Lagerloef, Tim Liu, Christophe Maes, Ricardo Matano, Thomas Meissener, Nicolas Reul, Gilles Reverdin, Monica Rhein, Roberto Sabia, Julian Schanze, Ray Schmitt, Tony Song, Meric Srokosz, Detlef Stammer, Graeme Stephens, Antonio Turiel, Nadya Vinogradova, Frank Wentz, Susan Wijffels, Pingping Xie, Lisan Yu, Simon Yueh","Linkage of the Water Cycle, Ocean Circulation, and Climate","Describes challenges in Earth System Science linking the water cycle, ocean circulation, climate, & biogeochemistry, focusing on the dominant oceanic element where salinity acts as a sentinel for the links. Emphasizes the need to continue/enhance ocean salinity measurements to maximize the synergy of satellite observations to study these links",http://surveygizmoresponseuploads.s3.amazonaws.com/fileuploads/15647/2289356/66-d5c509554e258d30eb31a63804edbf70_LeeTong.docx9,Attila,Komjathy,"NASA JPL, Caltech","Xing Meng,  Oscar Yang, Olga Verkhoglyadova",Combining Ground-Based and Spaceborne Data for Detecting and Monitoring Ionospheric Signatures Generated by Natural Hazards,"The white paper describes the urgent need for combining  ground-based, spaceborne GNSS and other measurements to characterize earthquake-tsunami coupling processes and better understand tsunami generation or their earthquake sources.",http://surveygizmoresponseuploads.s3.amazonaws.com/fileuploads/15647/2289356/184-08ca36cc19492c74de0f2368a9a0e4c5_KomjathyEarthScienceDS2015WhitePaperFinal.pdf10,Norman,Loeb,NASA Langley Research Center,"Kory J. Priestley, Patrick Minnis, Bill Smith, Jr., Wenying Su, David P. Kratz, Seiji Kato, David R. Doelling, Takmeng Wong, Paul W. Stackhouse, Patrick C. Taylor, Bruce A. Wielicki",Observing EarthÕs Energy and Water Cycles,Improved understanding and prediction of climate requires advances in model development and observation of EarthÕs energy and water cycles. It is paramount that our observing system accurately track how energy and water are distributed within the EarthÕs system over timescales commensurate with the underlying processes.,http://surveygizmoresponseuploads.s3.amazonaws.com/fileuploads/15647/2289356/36-9be2a296b3de9ee8fc2ecb22f2b8c983_LoebNormanG.docx11,Son,Nghiem,"Jet Propulsion Laboratory, California Institute of Technology","Cinzia Zuffada, Rashmi Shah, Stephen Lowe, and Clara Chew",Critical Roles of Wetlands in Methane Emission and Terrestrial Water Storage in a Changing Climate,"Wetland dynamics is crucial to changes in both atmospheric methane and terrestrial water storage in a changing climate.  IGBP-GAIM,  IPCC AR5, and Ramsar Convention hightlight the current deficiency  in global wetland dynamics monitoring, which urgently demands a new break-through approach in synergy with current surface  and satellite methods.",http://surveygizmoresponseuploads.s3.amazonaws.com/fileuploads/15647/2289356/44-d3d813175cbcc655d9a7db7158d767cd_NghiemSonV.docx12,Richard,Gross,"Jet Propulsion Laboratory, California Institute of Technology",Yoaz Bar-Sever,Terrestrial Reference Frame,"The terrestrial reference frame (TRF) is the foundation for virtually all space-based, airborne and ground-based Earth observations. But the most accurate reference frames available today are a factor of 5-10 less accurate than required. A satellite dedicated to improving the TRF is needed in order to meet the target requirement in a timely manner.",http://surveygizmoresponseuploads.s3.amazonaws.com/fileuploads/15647/2289356/184-64d0ae154f2d8b733756442e425be780_GrossRichardS.pdf13,Nathaniel,Livesey,"Jet Propulsion Laboratory, California Institute of Technology","M. L. Santee, J. L. Neu, H. Su, L. Froidevaux, L. F. Mill‡n, B. J. Drouin, J. H. Jiang, G. L. Manney, W. G. Read, A. Lambert, M. J. Schwartz, S. Wang, R. F. Jarnot",The critical role of the upper troposphere and stratosphere in climate and air quality,"We review outstanding science questions for Earth's upper troposphere and stratosphere and highlight critical needs for high vertical resolution measurements to address them. We emphasize the anticipated ""gap"" in such measurements in the coming decade, highlighted in international assessments, and note new capabilities enabled by NASA investments.",http://surveygizmoresponseuploads.s3.amazonaws.com/fileuploads/15647/2289356/36-6971c9a5712b94874640c143a25ff73e_LiveseyNathanielJ.pdf14,Xubin,Zeng,University of Arizona,"Steve Ackerman, Robert D. Ferraro, John J. Murray, Steven Pawson, Carolyn Reynolds, Joao Teixeira",Scientific Challenges and Opportunities in the NASA Weather Focus Area,"This White Paper is based on the NASA Weather Focus Area Community Workshop attended by about 70 invited participants in April 2015. Eleven science questions were raised, and seeking their answers led to four recommendations for measurements and Observing System Simulation Experiments, and three for modeling, data assimilation, and computing.",http://surveygizmoresponseuploads.s3.amazonaws.com/fileuploads/15647/2289356/66-17df8878d2338402963114cecb8f1598_ZengXubin.pdf15,Neil,Weston,National Geodetic Survey,,A White Paper on Significant Challenges in Earth System Science: Perspectives from the National Geodetic Survey,White paper on geodesy,http://surveygizmoresponseuploads.s3.amazonaws.com/fileuploads/15647/2289356/36-c019aa226d80d499fcae367b47f7927e_DecadalSurvey-NGS-WhitePaper-final.pdf16,Bjorn,Stevens,Max Planck Institute for Meteorology,"Sandrine Bony, Robert Pincus, Steven C. Sherwood, Masahiro Watanabe,  Dargan M. W. Frierson, Christian Jakob, Masa Kageyama, Ted G. Shepherd, A. Pier Siebesma, Adam H. Sobel and Mark J. Webb","Observational opportunities for addressing the Grand Science Challenge on Clouds, Circulation and Climate Sensitivity","We discuss observations important to the WCRP Grand Science Challenge on Clouds, Circulation and Climate Sensitivity. We focus on four questions essential to assessing the magnitude of global changes (climate sensitivity, relevant to mitigation) and advancing predictions of regional climate changes (relevant to adaptation measures).",http://surveygizmoresponseuploads.s3.amazonaws.com/fileuploads/15647/2289356/36-1dfe7f57edc67028b7bb180b3124fc4b_StevensBjorn.pdf17,Richard,Edwing,Center for Operational Oceanographic Products and Services,"Steve Gill, Greg Dusek",Addressing gaps in nearshore salinity measurements - A white paper submitted by NOS/CO-OPS,White paper on salinity measurements,http://surveygizmoresponseuploads.s3.amazonaws.com/fileuploads/15647/2289356/36-e354af88353019b45e429d4a13bdf53d_salinitywhitepaper_nos_coops-final.pdf18,Duane,Waliser,Jet Propulsion Laboratory/Caltech,"Gilbert Brunet (Environment Canada), Paul Dirmeyer (GMU), Harry Hendon (Centre for Australian Weather and Climate Research), Ben Kirtman (U. Miami), Randal Koster (GSFC/NASA), Arun Kumar (NCEP/NOAA), Hai Lin (Environment Canada), Pierre Lermusiaux (MIT), Eric Maloney (CSU), Mitch Moncrieff (NCAR), Michel Rixen (World Climate Research Program), Andrew Robertson (IRI), Ken Sperber (LLNL/DOE), Frederic Vitart (ECMWF), Duane Waliser (Jet Propulsion Laboratory/Caltech), Chidong Zhang (U. Miami)",Advancing the Science and Societal Benefits of Subseasonal to Seasonal (S2S) Environmental Prediction,"Demands are growing rapidly for environmental forecasts in the subseasonal to seasonal (S2S) range. Impacted areas include the water, food, energy, transportation and hazard sectors. A great return on investment is expected if S2S science and modeling can be advanced.  These advances hinge on maintaining and enhancing relevant observing systems.",http://surveygizmoresponseuploads.s3.amazonaws.com/fileuploads/15647/2289356/184-53796e216767164cd6c06a479cc1021c_WaliserDuaneE.pdf19,Peggy,O'Neill,NASA Goddard Space Flight Center,"Randy Koster/NASA GSFC, Jeffrey Piepmeier/NASA GSFC, Wade Crow/USDA ARS, Tom Jackson/USDA ARS",Long-Term Low Frequency Microwave Observations for Environmental Applications and Climate Assessment,"In a future of changing climatic conditions, the availability of water resources (or lack thereof) at a specific location or across regions of interest becomes a key factor leading to economic and societal stress.  This paper addresses the need for long-term low frequency microwave observations to improve knowledge of changing water availability.",http://surveygizmoresponseuploads.s3.amazonaws.com/fileuploads/15647/2289356/44-62237e38b55c38ee7a0767ec01b8eb1e_ONeillPeggyE.docx20,Jeffrey,Love,"US Geological Survey, Geomagnetism Program","Anna Kelbert, E. Joshua Rigler, Antti Pulkkinen",Geoelectromagnetic analysis for fundamental understanding and hazard mitigation,Geospace-Earth geomagnetic science modeling for fundamental understanding and hazard mitigation,http://surveygizmoresponseuploads.s3.amazonaws.com/fileuploads/15647/2289356/246-6201fe0218c2815ec071340810f84353_White+paper+-+SSB+2015+-+final.docx21,Mike,Johnson,National Weather Service (NOAA/DOC),Kim Runk,Data Use Considerations for Application of Decadal Missions in Operational Weather Support,The criteria used for successful application of ÒresearchÓ missions in weather ÒoperationsÓ has evolved due to a number of factors outlined in this paper.  It is our hope that the next NASA decadal mission programs will coordinate early with operational users so plans can be made to exploit these systems for operational purposes.,http://surveygizmoresponseuploads.s3.amazonaws.com/fileuploads/15647/2289356/66-565c48eda242e771e575afa6c90efad8_JohnsonMikeW.pdf22,Timothy,Schmit,NOAA/NESDIS Center for SaTellite Applications and Research (STAR),"Steve Ackerman, Jun Li, Ralph Petersen, Dave Tobin",Advanced high-spectral resolution infrared geostationary observations,"There are many potential uses for advanced high-spectral resolution infrared geostationary measurements: radiances, vertical moisture, atmospheric instability, improved atmospheric motion vectors, surface emissivity, cloud properties aerosols and trace gases. The geostationary perspective allows for a rapid refresh. There is a gap over the U.S.",http://surveygizmoresponseuploads.s3.amazonaws.com/fileuploads/15647/2289356/246-392b263c985fceec662468e7a4154d1c_SchmitTimothyJ.docx23,Anthony,Del Genio,NASA/Goddard Institute for Space Studies,"Steven Platnick, Ralf Bennartz, Stephen Klein, Roger Marchand, Lazaros Oreopoulos, Robert Pincus, Robert Wood",Low Clouds: Drivers of Climate Sensitivity and Variability,"The central role of low clouds in the uncertainty in  global climate sensitivity and erroneous simulations of important modes of climate variability are discussed. The role of satellite data in addressing these questions, the impact of continuing and improving current capabilities, and needed development of emerging technologies are described.",http://surveygizmoresponseuploads.s3.amazonaws.com/fileuploads/15647/2289356/246-03d9602eba34a3971ccd5d0a8046c418_DelGenioAnthonyD.pdf24,Zhenglong,Li,"University of Wisconsin-Madison, Space Science and Engineering Center","Jun Li, Timothy J. Schmit, Robert O. Knuteson, Eva E. Borbas, Jinlong Li",Advanced geostationary measurements: Diurnal Land Surface Emissivity,"A geostationary hyperspectral infrared sounder would add diurnal variations to the land surface emissivity products. The high temporal resolution would help better characterize accurate emissivity, which will benefit many applications: land surface modeling, radiance assimilation, and many satellite remote sensing products.",http://surveygizmoresponseuploads.s3.amazonaws.com/fileuploads/15647/2289356/66-b08cb1561d189599f151e25295b5a0c9_LiZhenglong.docx25,Dara,Entekhabi,MIT,"Joel Johnson, Mahta Moghaddam, Binayak Mohanty, Sassan Saatchi, Eric Small, Simon Yueh","Groundwater Recharge and Evapotranspiration: Fluxes at the Interface of Water, Energy, Biogeochemical and Human Systems",Recharge and evapotranspiration have already-realized several-fold changes as a result of land-use change. Their future is highly uncertain. They fields are not measured adequately and even their climatology is not well known.  We propose understanding their dynamics as a grand challenge and propose a global mapping technology to address it.,http://surveygizmoresponseuploads.s3.amazonaws.com/fileuploads/15647/2289356/66-59230361b3a58dc1142e07a48ff9c2b9_EntekhabiDara.pdf26,Donald,Argus,"Jet Propulsion Laboratory, California Institute of Technology","Felix Landerer, David Wiese, J.T. Reager, Tom Farr, Jay Famiglietti (all at JPL)",Evaluating changes in continental water resources,Use space observations to determine changes in total continental water and place in the context of conventional hydrologic measurements.,http://surveygizmoresponseuploads.s3.amazonaws.com/fileuploads/15647/2289356/246-9bc14dbf610b3cfae585cb3289a9deec_ArgusDonaldF.doc27,Philip,Dennison,University of Utah,"Sander Veraverbeke, Nancy HF French, Margarita Huesca, Yufang Jin, Tatiana Loboda, Jim Randerson, Dar Roberts, Brendan M Rogers, E. Natasha Stavros, Amin Tayyebi, Mike Tosca, Jun Wang",Burning Questions: Critical Needs for Remote Sensing of Fire Impacts on Ecosystems,"This paper summarizes critical Earth science questions related to fire processes. New types of space-based observations are required to advance our understanding of fire impacts on the carbon and water cycles, ecosystem processes, and ecosystem services. These new observations are urgent due to rapidly changing fire regimes, ecosystems and climate.",http://surveygizmoresponseuploads.s3.amazonaws.com/fileuploads/15647/2289356/36-3c69e4a5410a49ecb371c79e96bb745e_DennisonPhilipE.pdf28,Constantine,Lukashin,NASA Langley Research Center,"R.R. Baize, C. Bruegge, J.J. Butler, C. Cao, R. Cooke, C. Currey, D. Diner, D. Doelling, R.E. Eplee, B. Franz,  N. Fox, D. Goldin, D. Helder, T. Hewison, G. Kopp, J. Leckey, N.G. Loeb, A. Lyapustin, K. Lykke, J. McCorkel, G. Meister, S. Platnick, P. Pilewskie, K. Priestly, C.M. Roithmayr, Y.L. Shea, P.W. Speth, T.C. Stone, W. Sun, K. Thome, S. Wagner, B.A. Wielicki, J.T. Woodward, X. Xiong",Accurate Inter-Calibration of Spaceborne Reflected Solar Sensors,"In this white paper we describe the urgent need for accurate on-orbit inter-calibration of reflected solar sensors as a key challenge of Earth System Science. We illustrate the inter-calibration science objectives, expected impact and societal benefits from improved accuracy of the Earth observing system.",http://surveygizmoresponseuploads.s3.amazonaws.com/fileuploads/15647/2289356/44-1c6fefb8253f048abf1b11233d93122b_LukashinConstantine.pdf29,Helen,Worden,National Center for Atmospheric Research (NCAR),David Edwards,Accelerating the combined use of policy-relevant data and advanced atmospheric models to support air quality and climate decision making,"We describe the key challenges and potential capabilities for future policy-relevant data, in particular spatially and temporally dense observations of methane and tracers of atmospheric pollution such as carbon monoxide. These observations, when assimilated in modeling frameworks, are essential to support air quality and climate decision making.",http://surveygizmoresponseuploads.s3.amazonaws.com/fileuploads/15647/2289356/36-d4604be628f027386c33cfa347e9e7f0_WordenHelenM.pdf30,Michael,Behrenfeld,Oregon State University,"Jorge Sarmiento, Chris Hostetler",A decade of success in ocean remote sensing and a vision for the future,Response to Decadal Survey Request for Information with focus on ocean observations but including links to atmospheric sciences,http://surveygizmoresponseuploads.s3.amazonaws.com/fileuploads/15647/2289356/44-cebbae75378cbecabe2d29ef28658788_BehrenfeldMichaelJ.pdf31,Daniel,Jacob,Harvard University,NASA Air Quality Applied Sciences Team (AQAST),Air quality and climate forcing over North America in the next decade,Air quality management challenges in the US are evolving rapidly and are increasingly convolved with climate forcing issues. We make the case  that a long-term UV/Vis/SWIR/TIR geostationary satellite mission over North America in the next decade is critical for addressing these challenges.,http://surveygizmoresponseuploads.s3.amazonaws.com/fileuploads/15647/2289356/36-83ea3c8fd4d4f1f608e276a2e5d36dca_JacobDanielJ.docx32,Ralph,Ferraro,NOAA/NESDIS,"NOAA/NESDIS, NOAA/OAR, NOAA/NWS",An End to End Water Cycle Mission Focusing on Cloud and Precipitation Processes,"The focus of this white paper is to describe the scientific need and operational implications of an advanced water cycle mission that builds off the legacy of TRMM, GPM, CloudSat and SMAP.",http://surveygizmoresponseuploads.s3.amazonaws.com/fileuploads/15647/2289356/36-4e5d7fabff2cc1c79cf7dd773e5f837d_FerraroRalph.pdf33,Forrest G,Hall,NASAGSFC/UMBC,"Scott J. Goetz,Andrew Elmore,Lucy Hutyra,Chris Justice,Curtis Woodcock,Geoff Henebry,Matt Hansen,Tom Loveland, Jeff Masek,Andy Hansen, Matthew Clark, Forrest Melton, George Hurtt, Dar Roberts,Andy Hudak, Mike Falkowski, Ralph Dubayah, Jim Irons, Dave Schimel,Kenneth Davis, Colm Sweeney, Hank Margolis, Chris Williams Randy Kawa, Ben Bond-Lamberty, Chip Miller, Mike Wulder, Lahouari Bounoua, Jim Collatz, Josh Fisher, Tomohiro Oda, Jon Ranson,Thomas Hilker, Robert Tueuhauf, Amy Neuenschwander, Bruce Cook, Nancy Glenn, Crystal Schaaf, Son Nghiem, Simon Hook","Terrestrial Ecology, Carbon Cycle, Land Use / Land Cover Change, and Biodiversity (TECLUB) Priority Science Questions and Measurements","A 1500 word  summary of a two and a half day  Oct 2014 workshop engaging the TECLUB science communities to describe and prioritize research and measurements required to support key societal information needs, and to produce a  detailed description of their findings. 50 scientists participated in the workshop and  in the writing of the paper.",http://surveygizmoresponseuploads.s3.amazonaws.com/fileuploads/15647/2289356/36-6c1da70f919a98f78d2842901a82ba3c_TECLUB+1500+word+Submission.pdf34,Gerald,Mace,University of Utah,"Arlindo Da Silva, Richard Ferrare, Michael Behrenfeld,Graham Feingold, Lazoros Oreopoulos, Brian Cairns, Bastiaan Van Diedenhoven,  Roger Marchand, Michael J. Garay, David J. Diner, David Winker",The Link Between Climate Sensitivity Uncertainty and Understanding Cloud-Aerosol Interactions,How marine boundary layer clouds change in a warming world is a central cause of the disparity among climate models in predicting the Earth's climate sensitivity.  We argue that observational capabilities must keep pace with modeling capabilities if the climate sensitivity of the Earth to CO2 doubling is to be predicted with necessary accuracy.,http://surveygizmoresponseuploads.s3.amazonaws.com/fileuploads/15647/2289356/66-85328540b6225db2ac21476e1ed90c19_MaceGeraldG.pdf