73,Amy,Thomas,Battelle,,"6. Input to NRC Decadal Survey from a Broad Audience of Remote Sensing Scientists &ndash; Water, Agriculture, and Food Themes","To provide input to the committee and panels that will conduct the Decadal Survey, a group of remote sensing scientists in a broad range of research areas was canvassed during September-October 2015 using online data collection tools. This paper presents input from respondents on water resources, agriculture, and food security.",http://surveygizmoresponseuploads.s3.amazonaws.com/fileuploads/15647/2289356/36-433a28f13fb0456f67bdb6054e2823ea_ThomasAmyE6.pdf.pdf74,Amy,Thomas,Battelle,,7. Input to NRC Decadal Survey from a Broad Audience of Remote Sensing Scientists &ndash; Land-Ocean Themes,"To provide input to the committee and panels that will conduct the Decadal Survey, a group of remote sensing scientists in a broad range of research areas was canvassed during September-October 2015 using online data collection tools. This paper presents input from respondents on land and ocean thematic areas.",http://surveygizmoresponseuploads.s3.amazonaws.com/fileuploads/15647/2289356/36-edde6c5e82e9add0e996a0d54bc7856a_ThomasAmyE7.pdf.pdf75,Amy,Thomas,Battelle,,8. Input to NRC Decadal Survey from a Broad Audience of Remote Sensing Scientists &ndash; Air Quality-Fire Themes,"To provide input to the committee and panels that will conduct the Decadal Survey, a group of remote sensing scientists in a broad range of research areas was canvassed during September-October 2015 using online data collection tools. This paper presents input from respondents relevant to air quality, atmosphere and fires.",http://surveygizmoresponseuploads.s3.amazonaws.com/fileuploads/15647/2289356/66-55cd1572684276a50213dbaead1325d4_ThomasAmyE8.pdf.pdf76,Jessica,Neu,"Jet Propulsion Laboratory, California Institute of Technology","Daniel Jacob, Vivienne Payne, GEO-CAPE Atmospheric Science Working Group",The Future of Air Quality in the Developing World,"Much of the world is undergoing rapid industrialization and population growth, leading to serious air quality problems.   New high spatiotemporal resolution satellite measurements are needed to quantify, understand, and predict formation of ozone and aerosols and to monitor changes in air quality associated with urbanization as societies develop.",http://surveygizmoresponseuploads.s3.amazonaws.com/fileuploads/15647/2289356/243-3249971f0ebddee7eff7d4ad3e3726fa_NeuJessicaL.pdf77,Ralph,Milliff,"CIRES, University of Colorado","Dudley B. Chelton, Ziad S. Haddad, Robert A. Houze Jr., David G. Long, Brian E. Mapes, Todd Pett, David A. Randall, Gail Skofronick-Jackson, Frank Wentz",Mesoscale Convective System Life-Cycle Stages in the Global Maritime Tropics,"A transformative set of simultaneous atmosphere-ocean observations will quantify global maritime tropical mesoscale convective system life-cycles such that fundamental processes are better understood, parameterizations  are enhanced and more accurate operational forecasts are provided to mitigate effectively ahead of ensuing natural hazards.",http://surveygizmoresponseuploads.s3.amazonaws.com/fileuploads/15647/2289356/184-1173f0e61850c5bffcfac85b9a4e215b_MilliffRalphF.docx78,David,Tobin,University of Wisconsin-Madison,"Henry Revercomb, Bruce Wielicki",Infrared Radiance Intercalibration for Climate Quality Products and Benchmarking,"Many infrared satellite radiance and derived products can be greatly improved through intercalibration with observations from a potential mission/sensor aimed at providing radiance products with unprecedented accuracy, verified using on-orbit international standards.",http://surveygizmoresponseuploads.s3.amazonaws.com/fileuploads/15647/2289356/36-805436b3a79da6310e27e3d37b585ede_CLARREO+White+Paper+on+IR+Intercalibration-Tobin-29Oct15.docx79,Francis J,Turk,"Jet Propulsion Laboratory, California Institute of Technology","Susan van den Heever, Svetla Hristova-Veleva, Jeff L. Steward",Improving the Representation of Cloud Scale Processes Through the Integration of Observations and Models,"Future space-based microwave observations that concurrently capture the fine-scale microphysical and dynamical time scales of the cloud-to-precipitation process, and the localized environmental conditions, are at the core of improvements to cloud resolving models.",http://surveygizmoresponseuploads.s3.amazonaws.com/fileuploads/15647/2289356/66-03ee1ce8984c470e98c5743c16739eaa_TurkFrancisJ.pdf80,Sheekela,Baker-Yeboah,University of Maryland,"Tim Boyer, Lynn K. Shay, Eileen M. Maturi, David Donahue",Sea Surface Temperature and Ocean Heat Content from Space,"Ocean Heat Content (OHC) can be estimated using satellite and in situ measures of temperature and sea surface height. While space borne measures  yield abundant spatial coverage, in situ measures  are more dominantly used given their vertical extent. A comparison of both methods is needed to improve our assessment of OHC.",http://surveygizmoresponseuploads.s3.amazonaws.com/fileuploads/15647/2289356/183-d7ba2eb162991830fe53769ec3ed47bf_BakerYeboahSheekela.docx81,Gail,Skofronick-Jackson,NASA Goddard Space Flight Center,"Gail Skofronick Jackson, Graeme Stephens, Christian Kummerow, Jay Mace, Arlindo da Silva and attendees of Cloud and Precipitation Process workshops (URL http://pmm.nasa.gov/CAPPM)",Addressing Earth Science Challenges in Cloud and Precipitation Processes to Inform Climate Models,"Water is necessary for life on Earth, thus knowing where, when and how clouds form, and whether they precipitate or not, is vital for all civilization. We must assess the underlying cloud processes globally and locally that produce precipitation to inform and improve the next generation of climate and numerical weather prediction models.",http://surveygizmoresponseuploads.s3.amazonaws.com/fileuploads/15647/2289356/36-7e5e51547325ffeffad7dc22c8085b82_SkofronickJacksonGail.docx82,Kenneth,Pickering,NASA Goddard Space Flight Center,"Anne Thompson, Bryan Duncan, Mian Chin, Peter Colarco, Russell Dickerson, Paulo Artaxo, Christine Wiedinmyer",Air Quality in Tropical and Subtropical Megacities,"The paper recommends air quality monitoring over major population centers of the tropics and subtropics by geostationary satellite such that emission sources, the diurnal evolution of pollutants, and transport in this rapidly growing and developing region can be better understood and air quality alerts can be issued.",http://surveygizmoresponseuploads.s3.amazonaws.com/fileuploads/15647/2289356/184-ae945e48f861d05b01754b2ece79a4ba_PickeringKenneth.docx83,Mian,Chin,NASA Goddard Space Flight Center,"Shobha Kongragunta, Hongbin Yu, Lazaros Oreopoulos, Lorraine Remer, Alexei Lyapustin, Hiren Jethva, Omar Torres, Jun Wang, Patricia Castellanos, Charles Gatebe, and Robert Chatfield, on behalf of the GEO-CAPE Atmospheric Science Working Group",Understanding aerosol-cloud interaction processes with high spatiotemporal resolution observations from space,We recommend a strategy for making significant progress in understanding aerosol-cloud interactions and their environmental effects. It focuses on cloud regimes regionally with an integrated observing system that includes high spatiotemporal resolution observations from space complemented by arrays of ground-based networks and in-situ measurements.,http://surveygizmoresponseuploads.s3.amazonaws.com/fileuploads/15647/2289356/183-7235151d34cfda40ce56eaffc96ed535_ChinMian.pdf84,Eileen,Maturi,NOAA/NESDIS,"Eileen Maturi, Lynne Shay, Jodi Brewster, Benjamin Jaimes, John Lillibridge, Laury Miller, David Donahue",Spaced-Based Measurement and Evaluation of Sea Surface Temperatures and Oceanic Heat Content Variability NRC Decadal Survey Response,"The sea surface is a critical link that couples oceanic and atmospheric processes for both weather and climate studies affect. We seek to build a global, evaluated Ocean Heat Content suite of products  based on future altimetry missions.",http://surveygizmoresponseuploads.s3.amazonaws.com/fileuploads/15647/2289356/184-d0162801b467e1bdcb3e4909cc1c7fec_Maturieileenm.docx85,Nicholas,Meskhidze,North Carolina State University,"Susannah M. Burrows, Mike Behrenfeld, Sarah D. Brooks, Doug Collins, Paul DeMott, Brett Gantt, Santiago Gass_assandra Gaston, Greg McFarquhar, Richard Ferrare, Chris Hostetler, Yong Hu, Matt Johnson, Damien Josset, Ernie Lewis, Rich Moore, Thanos Nenes, Phil Rasch, Lynn Russell, Sasha Smirnov, Kostas Tsigaridis, Patricia Quinn, Rob Wood",Marine aerosol-cloud-climate interactions,"Narrowing the gap in the current understanding of anthropogenic contribution to a changing climate requires development of new space-based measurement capabilities to provide high-resolution, vertically-resolved retrievals of aerosols and ocean sub-surface, concurrently with ocean biological parameters, linked to field/lab experiments and modeling.",http://surveygizmoresponseuploads.s3.amazonaws.com/fileuploads/15647/2289356/245-c89443a7fe00246515e9bcd9c5009604_Marine+aerosol-cloud-climate+interactions.pdf86,Huai-Min,Zhang,NOAA National Centers for Environmental Information,John J. Bates,The Aspects of Integration of the Satellite platforms as well as including In-Situ Platforms for Global Gridded Products of Various Resolutions,The scope of this paper is in the aspects of the integration of observations from various satellite platforms as well as integration of satellite and in-situ platforms for practical global gridded and blended production for supported highest resolutions and accuracy as possible.,http://surveygizmoresponseuploads.s3.amazonaws.com/fileuploads/15647/2289356/66-04e6b6706a232a2a23cace4091c8d64e_ZhangHuaiMin.pdf87,Carl,Mears,Remote Sensing Systems,"Frank J. Wentz, William Blackwell, Philip W. Rosenkranz, Benjamin D. Santer",Maintaining and Improving Upper Air Temperature Records,"We describe the current uncertainties in satellite-derived upper air temperature datasets.  We then briefly outline a mission to resolve these issues, improving the estimates of atmospheric temperature change from late 1978 onward.",http://surveygizmoresponseuploads.s3.amazonaws.com/fileuploads/15647/2289356/246-9b6735e80378d0f63f7c348f04b35d8f_MearsCarlA.pdf88,Dudley,Chelton,Oregon State University,"J. T. Farrar (WHOI), R. M. Samelson (CEOAS)",Wind-driven Near-surface Vertical Motion in the Ocean,Systematic global observations are needed to understand the ocean&rsquo;s near-surface vertical motion from the large scale through the mesoscale and into the submesoscale. Suitable estimates of vertical motion can be obtained using Doppler scatterometer measurements of  surface wind stress and surface ocean horizontal current.,http://surveygizmoresponseuploads.s3.amazonaws.com/fileuploads/15647/2289356/36-be2fcd40a9f47981ad7ac11eb7a03615_CheltonDudleyB.pdf89,R. Michael,Hardesty,CIRES/University of Colorado and NOAA,"Robert Atlas, Wayman Baker, David Emmitt, Ron Gelaro, Bruce Gentry, Rolf Langland, John Pereira, Oliver Reitebuch, Lars Peter Riishojgaard, Vijay Tallapragada, Sara Tucker, Carl Weimer",Doppler Wind Lidar (DWL) Technology is Ready to be Demonstrated in Space,"This white paper briefly highlights the key science advances expected with a space-based Doppler Wind Lidar (DWL), the DWL technology advances achieved since the previous Decadal Survey, and why only a space-based DWL can address some key Earth Science challenges and questions.",http://surveygizmoresponseuploads.s3.amazonaws.com/fileuploads/15647/2289356/44-03d5d0ee9051865a1f28d84ac051dda3_Hardesty+RMichael.pdf90,Matthew,Sturm,University of Alaska Fairbanks,"Jessica Lundquist, Alex Langlois, Andrew Slater, Michael Durand, Thomas Painter, Chris Derksen, Glen Liston, Martyn Clark, Simon Yueh, Jeff Deems",The Need for Improved Understanding and Remote Sensing of Snow Depth and Snow Water Equivalent,"Snow is critically important to human welfare, affecting security, economics and climate. We currently lack effective means for accurately tracking snow, but recent developments in 4 areas, if integrated into a seamless system, could deliver snow depth and snow water equivalent data at local to global scales, benefiting billions of people.",http://surveygizmoresponseuploads.s3.amazonaws.com/fileuploads/15647/2289356/66-bbcfe23790065fd85e96b6ad52c28b1b_SturmMatthew.docx91,David,Schimel,Jet Propulsion Lab,"Berrien Moore III, Piers Sellers, David Baker, Colorado State University, Joe Berry, Carnegie Institution for Science, Kevin Bowman, NASA, JP, Abhishek Chatterjee, NASA, GSFC, David Crisp, NASA, JPL, Sean Crowell, University of Oklahoma, Scott Denning, Colorado State University, Riley Duren, NASA, JPL, Michelle Geirach, NASA, JPL, Kevin Gurney, Arizona State University, Kathy Hibbard, NASA, TE, Richard A. Houghton, Woods Hole Research Ctr., Debbie Huntzinger, Northern Arizona University, George Hurtt, University of Maryland, Ken Jucks, NASA, UARP, Randy Kawa, NASA, GSFC, Randy Koster, NASA, GSFC, Charlie Koven, Lawrence Berkeley National Lab, Yiqi Luo, University of Oklahoma, Jeff Masek, NASA, GSFC, Galen McKinley, Univ. of Wisconsin-Madison, Chip Miller, NASA, JPL John B. Miller, NOAA, ESRL, University of Oklahoma , Paul Moorcroft, Harvard University, Ray Nassar, Environment Canada, Chris O&rsquo;Dell, Colorado State University, Leslie Ott, NASA, GSFC, Steven Pawson, NASA, GSFC, Michael Puma, Columbia University, Tris Quaife, University of Reading, Haris Riris, NASA, GSFC, Natasha Romanou, NASA, GISS, Cecile Rousseaux, NASA, GSFC, Andrew Schuh, Colorado State University, Elena Shevliakova, GFDL, Ying Ping Wang, Center for Australian Weather, Chris Williams, Clark University, Xiangming Xiao, University of Oklahoma, Tatsuya Yokota, NIES Japan",Carbon and Climate,"Changes in  radiative forcing  from greenhouse gases is the most important driver of climate change. CO2 concentrations would be  higher if it were not for   uptake by the terrestrial biosphere and oceans, Understanding how  emissions affect atmospheric concentrations and hence climate is a  grand challenge for Earth System Science.",http://surveygizmoresponseuploads.s3.amazonaws.com/fileuploads/15647/2289356/183-74cf03a4f890fbbcc0049499729d0bca_SchimelDavidS.pdf92,Lora,Koenig,"University of Colorado, National Snow and Ice Data Center","Marco Tedesco, Mary Albert, Patrick Alexander, Willem Jan van de Berg, Michiel van den Broeke, Kimberly Casey, Vena Chu, Indrani Das, Richard Forster, Derrick Lampkin, Ron Kwok, Michael MacFerrin, Joseph MacGregor, Cl_nt Mi_, Twila Moon, Thomas Neumann, Allen Pope, Harihar Rajaram, Ted Scambos, Mark Serreze, Laurence Smith",The importance of understanding and quantifying surface processes over the cryosphere for improved climate and sea level rise predictions,"Warming temperatures, amplified in the Arctic, are melting glaciers and ice sheets and diminishing Arctic sea ice extent and volume. This white paper advocates for satellite resources to monitor surface processes, such as melt water production, runoff, accumulation, and storage/retention, at high spatio-temporal resolutions over the cryosphere.",http://surveygizmoresponseuploads.s3.amazonaws.com/fileuploads/15647/2289356/44-af92e0f395e6147172b8cdbc8dc88876_KoenigLoraS.pdf93,Joshua,Fisher,"Jet Propulsion Laboratory, California Institute of Technology","Elizabeth Middleton, Forrest Melton, Martha Anderson, Christopher Hain, Richard Allen, Matthew McCabe, Jean-Pierre Lagouarde, Kevin Tu, Dennis Baldocchi, Phil Townsend, Johan Perret, Diego Miralles, Duane Waliser, Andrew French, Eric Wood, Jay Famiglietti, Graeme Stephens, David Schimel, Simon Hook","Evapotranspiration:  A Critical Variable Linking Ecosystem Functioning, Carbon and Climate Feedbacks, Agricultural Management, and Water Resources","This White Paper describes the key challenges, timeliness, and space-based viewpoint for Evapotranspiration (ET), with links to ecosystem functioning, carbon and climate feedbacks, agricultural management, and water resources. It is authored by a sampling across government agencies, universities, private sector, and both domestic and international.",http://surveygizmoresponseuploads.s3.amazonaws.com/fileuploads/15647/2289356/66-7c5da975ba27b12cfee37c5a49d69019_FisherJoshuaB.pdf94,Tamlin,Pavelsky,University of North Carolina,"Cedric H. David, Jerad D. Bales, Michelle M. Gierach, Liviu Giosan, Michael P. Lamb, Carl J. Legleiter, John M. Melack, Frank E. Muller-Karger, Jeffrey E. Richey, Ernesto Rodriguez, Marc Simard, and Laurence C. Smith","From the Mountains to the Sea: Interdisciplinary Science and Applications Driven by the Flow of Water, Sediment, and Carbon","Aligning human interests with environmental stewardship of fresh water and coastal oceans is a grand challenge, particularly in our rapidly changing world.  The future of these resources is uncertain, and scientific knowledge of processes governing them remains limited.  Space-based remote sensing provides a pathway to greater global understanding.",http://surveygizmoresponseuploads.s3.amazonaws.com/fileuploads/15647/2289356/184-c5472ced67a5aee51440a486e16f9150_PavelskyTamlinM.pdf95,Jessica,Neu,"Jet Propulsion Laboratory, California Institute of Technology","Kevin Bowman, Stan Sander, Daniel Jacob, GEO-CAPE Atmospheric Science Working Group",Understanding the Co-Evolution of Air Quality and Climate Forcing in a Rapidly Changing World,There is an urgent need for optimized strategies to improve air quality and reduce anthropogenic global warming.  New satellite measurements are required to accurately quantify emissions of both long- and short-lived climate forcers and relate them to atmospheric concentrations and radiative forcing in an integrated way.,http://surveygizmoresponseuploads.s3.amazonaws.com/fileuploads/15647/2289356/243-af1f0f5098813d9c4b93a76e18f43729_NeuJessicaL2.pdf96,Wendy,Calvin,"University of Nevada, Reno","Bernard E. Hubbard (USGS), Raymond F. Kokaly (USGS), Debsunder Dutta (Universisty of Illinois)","Key Questions and Challenges in Dynamic Earth Processes, Natural Resources, and Hazards linked to Geologic and Soil Surface Composition","This white paper discusses the major questions in landscape sciences addressed through surface compositional studies.  Earths dynamic surface processes cause land surface change due to erosion, degradation, and desertification, lead to concentration of natural resources, and create landscapes susceptible to natural or human-influenced hazards.",http://surveygizmoresponseuploads.s3.amazonaws.com/fileuploads/15647/2289356/243-18405eee969ca7e27d8c17f7057cc7ba_CalvinWendyM.pdf97,Sue,Estes,University of Alabama in Huntsville,,Input to the NRC Decadal Survey for Earth Science and Applications from Space Health and Air Quality Applications,Paper provides inputs to inform health and air quality applications recommendations for the Decadal Survey.  A session of the NASA Health and Air Quality Applications Team Meeting held in Park City in September 2015 was dedicated to addressing this survey.  The meeting brought together community experts that use Earth observation data and systems.,http://surveygizmoresponseuploads.s3.amazonaws.com/fileuploads/15647/2289356/184-604c5f7eb3c3d657f7077f81f05761b3_Decadal+Article+Nov+2015.pdf98,Ralph,Kahn,NASA Goddard Space Flight Center,"Timothy Berkoff, Gao Chen, Arlindo da Silva, Richard Ferrare, Steven Ghan, Thomas Hanisco, J. Vanderlei Martins, Cameron McNaughton, Daniel Murphy, John Ogren, Joyce Penner, Peter Pilewskie, John Seinfeld",The Role of Systematic Aircraft Measurements in Characterizing Aerosol Air Masses,Systematic aircraft in situ measurements in a modest operational program can resolve key limitations of existing and future satellite aerosol data for climate and air quality applications.,http://surveygizmoresponseuploads.s3.amazonaws.com/fileuploads/15647/2289356/246-7656f9be839b8fdd31322cfa78399e9f_ACE_Aerosol-Aircraft_RFI_response.docx99,Natalie,Mahowald,Cornell University,"Greg Okin, Carlos Perez, Paul Ginoux, Olga Kalashnikova, Ron Miller, Roger Clark, Robert O. Green",Closing the Earth Surface Dust Source Composition Gap for Earth System Understanding and Modeling,"Mineral dust emitted to the atmosphere impacts direct and indirect radiative forcing, tropospheric chemistry, ecosystem fertilization, and human health.  Although source composition is as important as dust amount, dust composition is poorly constrained. Global space spectroscopic measurement of surface mineralogy closes this knowledge gap.",http://surveygizmoresponseuploads.s3.amazonaws.com/fileuploads/15647/2289356/66-298b3b8bb3b5f4027ab79ee7c58c81eb_MahowaldNatalieM.pdf100,John,Worden,"Jet Propulsion Laboratory, California Institute of Technology","Jessica Neu, Daniel Jacob, Vivienne Payne, GEO-CAPE Atmospheric Science Working Group",Air Quality Impacts on Crop and Ecosystem health,Air pollution impacts on crop and ecosystem health and the subsequent changes in carbon uptake are critical to food security and climate warming.  New satellite measurements are needed to relate concentrations of key atmospheric pollutants to markers of ecosystem health at the spatiotemporal scales relevant to understanding these impacts.,http://surveygizmoresponseuploads.s3.amazonaws.com/fileuploads/15647/2289356/243-c07d201fac5dd0d7b459733b5965d3b4_WordenJohnR.pdf101,kevin,gurney,arizona state university,"Karen C. Seto, Miguel Rom_ Riley Duren",Urban Carbon Monitoring 2.0: A critical need for carbon cycle science and climate policy,Outlines the need to improve monitoring of urban carbon emissions and related urban quantities from space.,http://surveygizmoresponseuploads.s3.amazonaws.com/fileuploads/15647/2289356/36-63136ce609f2f25b0bb5f74b555bebca_GurneyKevinR.docx102,John,Worden,"Jet Propulsion Laboratory, California Institute of Technology","Jessica Neu, Daniel Jacob, Vivienne Payne, GEO-CAPE Atmospheric Science Working Group",Air Quality Impacts on Crop and Ecosystem health,Air pollution impacts on crop and ecosystem health and the subsequent changes in carbon uptake are critical to food security and climate warming.  New satellite measurements are needed to relate concentrations of key atmospheric pollutants to markers of ecosystem health at the spatiotemporal scales relevant to understanding these impacts.,http://surveygizmoresponseuploads.s3.amazonaws.com/fileuploads/15647/2289356/183-b5d1e37c8d03738ec279d95a52aee79a_WordenJohnR.pdf103,Panagiotis,Vergados,"Jet Propulsion Laboratory, California Institute of Technology","Panagiotis Vergados, Anthony J. Mannucci",Constraining Climate Sensitivity Using Satellite Observations,"Narrowing down the uncertainty of climate feedbacks is important for improving  climate research. Current observing networks cannot capture the 3D spatio-temporal variability of water vapor, globally and under all weather conditions. Timely implementation of satellite data are critically needed to improve climate physics and existing models.",http://surveygizmoresponseuploads.s3.amazonaws.com/fileuploads/15647/2289356/36-cf2bad78da88a8aa872de39f10012e08_VergadosPanagiotis.docx104,Andrew,Thorpe,"Jet Propulsion Laboratory, California Institute of Technology","Christian Frankenberg, Konstantin Gerilowski, David Thompson, Bo-Cai Gao, Dar Roberts, Philip Dennison, Andre Hollstein, Glynn Hulley, Joshua Fisher, Vincent Realmuto, Florian Schwandner, Eric Kort, Kam Weng Wong, Tanvir Islam",Mapping atmospheric constituents at high spatial resolution to understand their influence on Earth&amp;rsquo;s climate,"Facing climate change, it is critical to understand the influence of natural/anthropogenic atmospheric constituents on Earth&rsquo;s energy budget. A spaceborne imager with spectroscopic capability and fine spatial resolution would permit mapping numerous species that influence radiative forcing, including CH4, CO2, H2O, SO2, and aerosols.",http://surveygizmoresponseuploads.s3.amazonaws.com/fileuploads/15647/2289356/246-ddf93c4aec15a444c98b0f85675af36b_ThorpeAndrewK.pdf105,Frank,Wentz,Remote Sensing Systems,"Carl Mears ,Benjamin D. Santer, Dudley Chelton, Mark Bourassa, Ralph Milliff",Continuity of Air-Sea Climate Variables,"This white paper advocates continuing the 2+ decades of air-sea climate variables measured by satellite active and passive microwave sensors. These climate variables include through-clouds sea-surface temperature and wind stress, near-surface vector winds, and atmospheric moisture in the form of vapor, clouds, and rain.",http://surveygizmoresponseuploads.s3.amazonaws.com/fileuploads/15647/2289356/245-044a54492405daf4b1243ae0d1613d7d_WentzFrankJ.pdf106,Robert,Treuhaft,"Jet Propulsion Laboratory, California Institute of Technology","Michael Keller, Maxim Neumann",Global Forest Structure and Biomass Monitoring from Space,"Uncertainties in the level of and changes in carbon  in forests have a large impact on the uncertainty in future climate projection. Global above ground biomass monitoring is recommended. In particular, tropical forests may play a role in the missing carbon sink.  The Decadal Survey must look at diverse  space-based remote sensing options.",http://surveygizmoresponseuploads.s3.amazonaws.com/fileuploads/15647/2289356/243-b593d0896fcfcde3b3bb39ff417ca8b0_TreuhaftRobertN.docx