107,Margaret,Glasscoe,"Jet Propulsion Laboratory, California Institute of Technology","Gregory Lyzenga, Andrea Donnellan, Jay Parker, Christopher Milliner",Constraining Models of Interacting Fault Systems in Active Tectonic Zones using Geodetic Imaging to Improve Hazard Analysis,"Improved simulations will help characterize deformation associated with earthquakes, and help assess and mitigate their associated hazard. Spaceborne observations provide data that are necessary to validate models, but also provide synoptic, time-critical situational awareness to responders and decision makers in a disaster.",http://surveygizmoresponseuploads.s3.amazonaws.com/fileuploads/15647/2289356/36-927daf0999423d077d02925c874cf298_GlasscoeMargaretT.pdf108,Mark,Bourassa,Florida State University,"Steven L. Morey, Shang-Ping Xie,  Dudley Chelton, Roger Samuelson,  Tom Farrar,  Nikolai Maximenko, Andrew Thompson",Wind and Current Coupling,"Broad description of the many important science issues, applications, and operational activities for which understanding the coupling of winds and currents is important",http://surveygizmoresponseuploads.s3.amazonaws.com/fileuploads/15647/2289356/243-65112c776f5045ff64b30d3ac719a22e_BourassaMarkA.pdf109,Bruce,Wielicki,NASA Langley Research Center,"Betsy Weatherhead, William Collins, V. Ramaswamy, Brian Soden, Tom Karl, Kevin Trenberth, Eric Rignot, Mark Abbott, Lee-Lueng Fu, Graeme Stephens, David Winker, Norman Loeb, Judith Lean, Joyce Penner, Robert Pincus, Greg Kopp, Peter Pilewskie, Hank Revercomb, Martin Mlynczak, David Johnson, Constantine Lukashin, William Smith, Sr., Xianglei Huang",The Need for a Climate Observing System,"The nation and the world need a rigorous climate observing system.  Given the large societal issues related to climate change, filling this hole in our scientific approach represents one of the greatest challenges to the task of this Decadal Survey.  While the Survey alone cannot solve this challenge, it can present the need and a vision forward.",http://surveygizmoresponseuploads.s3.amazonaws.com/fileuploads/15647/2289356/44-e44d54caa66fc0f760e3857f92a7fd67_Wielicki+et+al+Need+for+a+Climate+Observing+System+NRC+2017+DS+White+Paper+V2.pdf110,Bruce,Wielicki,NASA Langley Research Center,"William Collins, V. Ramaswamy, Brian Soden, Tom Karl, Graeme Stephens, David Winker, Norman Loeb, Judith Lean, Joyce Penner, Robert Pincus, Greg Kopp, Peter Pilewskie, Hank Revercomb, Martin Mlynczak, David Johnson, Constantine Lukashin, William Smith, Sr., Xianglei Huang",The Scientific and Societal Challenge of Reducing Uncertainty in Climate Sensitivity,The next decade will be critical to improve the ability of current and future observations to constrain the factor of 4 uncertainty (90% confidence) in equilibrium climate sensitivity.  This uncertainty alone causes a factor of 10 or more uncertainty in future economic impacts of climate change.  Increased observation accuracy is essential.,http://surveygizmoresponseuploads.s3.amazonaws.com/fileuploads/15647/2289356/66-8b158cc93e788c72d1a196c5f9a15af3_Wielicki+et+al+Climate+Sensitivity+NRC+2017+DS+White+Paper+V2.pdf111,WILLIAM,DENIG,National Oceanic and Atmospheric Administration,"Thomas Berger,  Rodney Viereck, Naomi Mayuyama, Peter Pilewski, Cora Randall, Craig Rodgers, Janet Machol, Arnaud Chulliat",On the Contributions of Operational Space Weather Satellite Data for Earth Science Research,This white paper discusses the status of operational satellite measurements that are primarily used for space weather applications but also contribute to earth science research.,http://surveygizmoresponseuploads.s3.amazonaws.com/fileuploads/15647/2289356/36-7ee1f40aef412a2a1dccc9a737fff82c_DenigWilliamF.pdf112,Roger,Clark,Planetary Science Institute,,Local to Global Remote Sensing of Surface and Atmospheric Chemistry,"A more complete understanding of our environment on planet Earth requires understanding of the chemistry of the Earth system, including solid surface, liquid, the cryosphere and the atmosphere.  Remote chemical mapping of the surface and atmosphere can only be done with imaging spectrometers.",http://surveygizmoresponseuploads.s3.amazonaws.com/fileuploads/15647/2289356/66-c4e11291cff68cda92faf46f3e1dd45a_clark-earth-white-paper-for-decadal-survey-2015.11.02.v1.0.pdf113,Dong,Wu,NASA/Goddard Space Flight Center,"Alexandar Marshak, Lazaros Oreopoulos, Kurtis Thome",Constellation approaches to assessing earth radiation imbalance,"Measuring earth radiation imbalance is a challenge, requiring stable, accurate sensors sampling multiple geometries and local times.  Current measurements achieve this by supplementing low-earth orbit data with models and ancillary data.  Achieving, however, accuracies of 0.5 W/m2 (daily means) and 0.1 W/m2 (annual) requires alternate approaches.",http://surveygizmoresponseuploads.s3.amazonaws.com/fileuploads/15647/2289356/243-79c6b2fb12cc2b52b3faa51803a3f3c6_wudongl.docx114,Steven,Morey,Florida State University,"Nikolai Maximenko, Mark Bourassa",Satellite Measurements of Ocean Surface Currents &ndash; Critical Applications,Discusses the need for satellite-based ocean surface current observations for science and societal applications.,http://surveygizmoresponseuploads.s3.amazonaws.com/fileuploads/15647/2289356/183-aee7b592e396080a73f2738102c1f8c6_MoreyStevenL.pdf.pdf115,Mahta,Moghaddam,University of Southern California,"Dara Entekhabi, Scott Goetz,  John Kimball,  Randy Koster, Walter Oechel, Rolf Reichle, Sassan Saatchi",Permafrost Active Layer Dynamics represent a Critical Climate Feedback requiring Space-based Measurements,Key Challenge/Question: What are the spatial distributions and temporal dynamics of permafrost soils and what are their feedbacks to/from the regional and global climate?,http://surveygizmoresponseuploads.s3.amazonaws.com/fileuploads/15647/2289356/243-5d6abe9cf9f68b2b14d0f20a74124674_permafrost-DS-Oct2015-final.pdf116,Daniel,Crichton,NASA/JPL,"D. Crichton, M. Little, G. Djorgovski, R. Doyle, Y. Gil, E. Law, J. Lemoigne-Stewart, C. Lukashin, P. Mehrotra, J. Nelson, D. Williams",Data and Computational Science Challenges for Earth Science Observational Systems,"Data and Computational Science are emerging as critical technologies areas that will increase the ability to capture, manage, and analyze data from earth observing systems.  Considering the technical capabilities from onboard computing all the way to analysis is critical as data is capture across multiple sensors and must be brought together.",http://surveygizmoresponseuploads.s3.amazonaws.com/fileuploads/15647/2289356/36-9ff75c06c2727b566a1921ae60e85dde_Data+Science-Computational+Science+Challenges.pdf117,Michael,Garay,"Jet Propulsion Laboratory, California Institute of Technology","James R. Campbell, David J. Diner, Ralph A. Kahn, Matthew D. Lebsock, Po-Lun Ma, J. Vanderlei Martins, Felix C. Seidel, Jennifer D. Small Griswold, Armin Sorooshian, Marcin L. Witek",Addressing the Aerosol-Cloud-Precipitation Interaction Problem through Process Understanding,Addressing the critical aerosol-cloud-precipitation interaction problem will require coordinated space-based and suborbital observations of processes.  Spatial and temporal requirements can only be met by placing instruments on a constellation of microsatellites in low Earth orbit able to make multiple observations at high resolution over time.,http://surveygizmoresponseuploads.s3.amazonaws.com/fileuploads/15647/2289356/44-658413a5a90d35ba562c515679390aec_GarayMichaelJ.pdf118,Annmarie,Eldering,Jet Propulsion Laboratory/ Caltech,"David Schimel, David Crisp, Charles Miller, Frederic Chevallier",CO2 Data Record Continuity Through Cross Calibration and Expansion,"Continuity of XCO2 data are critical to understanding the drivers of interannual variability in carbon sources and sinks, yet there is a pending gap in XCO2 measurements. We describe a strategy that is centered on the cross calibration of international remote sensing instrument to achieve this needed continuity.",http://surveygizmoresponseuploads.s3.amazonaws.com/fileuploads/15647/2289356/184-b6b68cf1de26190ea50d5c59ba808127_ElderingAnnmarie.pdf119,Joao,Teixeira,"Jet Propulsion Laboratory, California Institute of Technology","Chi Ao (JPL, Caltech), Anton Beljaars (ECMWF), Christopher Bretherton (UW),  Axel von Engeln (EUMETSAT), Matthew Lebsock (JPL, Caltech), David Schimel (JPL, Caltech), Pier Siebesma (KNMI, TU Delft), Graeme Stephens (JPL, Caltech),  Jordi Vila (Wageningen UR), Robert Wood (UW)","The Atmospheric Boundary Layer: Climate, Weather and Applications",The atmospheric boundary layer (ABL) plays a key role in weather and climate. Improved ABL parameterizations will lead to better weather/climate forecasts. Detailed observations of ABL temperature and water vapor structure are essential for progress. These observations are not yet available from space but are within our grasp in the next 10 years.,http://surveygizmoresponseuploads.s3.amazonaws.com/fileuploads/15647/2289356/66-54da574b52a867940203a3543471a41a_TeixeiraJoao.pdf120,Ryan,Pavlick,"Jet Propulsion Laboratory, California Institute of Technology","David Schimel (Jet Propulsion Laboratory, California Institute of Technology), Walter Jetz (Yale University), Jeannine Cavender-Bares (University of Minnesota), Frank Davis (University of California, Santa Barbara), Gregory P. Asner (Department of Global Ecology, Carnegie Institution of Washington), Robert Guralnick (Florida Museum of Natural History, University of Florida), Jens Kattge (Max-Planck Institute for Biogeochemisty), Andrew M.  Latimer (University of California, Davis), Paul Moorcroft (Harvard University), Michael E. Schaepman (University of Zurich), Mark P. Schildhauer (NCEAS, University of California, Santa Barbara), Fabian D. Schneider (University of Zurich), Franziska Schrodt (Max-Planck Institute for Biogeochemisty), Ulrike Stahl (Max-Planck Institute for Biogeochemisty), Susan L. Ustin (University of California, Davis)",Biodiversity,"Global biodiversity is one of the most crucial and least-observed dimensions of the earth system and increasingly crucial for anticipating changes to both the climate system and ecosystem services.  Satellite observations could provide global monitoring of one key dimension of global biodiversity, plant functional diversity.",http://surveygizmoresponseuploads.s3.amazonaws.com/fileuploads/15647/2289356/36-cc59f1b8061f41b296ae2586b3f99cb0_BiodiversityRFIfinal+%282%29.pdf121,Forrest,Melton,NASA Ames Research Center Cooperative for Research in Earth Science and Technology (ARC-CREST),"Richard Allen, University of Idaho, Tony Morse, Spatial Analysis Group, Boise, ID, Ayse Kilic, University Nebraska-Lincoln, Martha Anderson, USDA Agricultural Research Service, John Bolten, NASA Goddard Space Flight Center, Rita Cestti, World Bank, Larry Dunsmoor, Klamath Tribe, Tyler Erickson, Google, Inc., Joshua Fisher, NASA Jet Propulsion Laboratory, Chris Hain, University of Maryland, Nagaraja Harshadeep, World Bank, Michael Hobbins, NOAA, Justin Huntington, Desert Research Institute, Simon Hook, NASA Jet Propulsion Laboratory, William Kustas, USDA Agricultural Research Service, Christine Lee, NASA Jet Propulsion Laboratory, Martin Mendez-Costabel, E&J Gallo Winery, John Tracy, University of Idaho, James Verdin, USGS, Tony Willardson, Western States Water Council, Steve Wolff, Wyoming State Engineer&rsquo;s Office, Duane Woodward, Central Platte Natural Resources District",Evapotranspiration Mapping for Water Security:   Recommendations and Requirements,This white paper focuses on the societal benefits and applications of satellite mapping of evapotranspiration (ET) and its use to address a wide range of water resource management challenges and information needs.,http://surveygizmoresponseuploads.s3.amazonaws.com/fileuploads/15647/2289356/36-4e32f7da6d33bb4e962dc0d8d0a03113_MeltonForrestS.pdf122,Jordan,Gerth,University of Wisconsin - Madison,"Ralph Petersen, Robert Rabin, Timothy Schmit",Advanced infrared sounder in geostationary orbit: Monitoring water vapor evolution with high spatial and temporal resolution,"Monitoring the horizontal and vertical distribution of atmospheric water vapor is necessary for understanding the details of the hydrological cycle, and characterizing convection. Given the need for relatively high temporal resolution, an advanced geostationary infrared sounder is proposed to meet this ongoing challenge of the weather community.",http://surveygizmoresponseuploads.s3.amazonaws.com/fileuploads/15647/2289356/36-ffb884453b52db57d53887bceb3cedd8_GerthJordanJ.pdf123,Olga,Kalashnikova,Jet Propulsion Laboratory,"Yang Liu, John E. Langstaff, Randall V. Martin, Joel Schwart, Michael Brauer, Jun Wang, Beate Ritz, Kembra L. Howdeshell, Judith R. Qualters,David J. Diner, Michael J. Garay, Chris Hostetler, Richard Ferrare, Sharon Burton",Societal Benefits of Composition-Resolved Particulate Matter Monitoring for Assessing Health Impacts Associated with Specific Pollution Sources,"Exposure to particulate matter (PM) has been linked to adverse health effects, however toxicity of specific PM types is much less certain. Surface monitors are too spatially and temporally limited for practical use in epidemiological studies. Space-based observations would yield significant societal benefits and vital information on PM type.",http://surveygizmoresponseuploads.s3.amazonaws.com/fileuploads/15647/2289356/246-e13835c6248d1e94f335a5ebfe1019ef_KalashnikovaOlgaV.pdf124,David,Winker,NASA Langley Research Center,"Robert Pincus, Bruce Weilicki, Helene Chepfer, Sandrine Bony, Amin Nehrir","Clouds, Water Vapor, and Climate Sensitivity","Reducing the range of climate sensitivity estimated from global models requires reducing uncertainties in cloud feedbacks.  Potential mechanisms responsible for these feedbacks have been proposed, but require testing against observations.  We discuss the observations needed to meet these challenges.",http://surveygizmoresponseuploads.s3.amazonaws.com/fileuploads/15647/2289356/66-16d7b743ca34105dc1a74eacccaa3628_WinkerDavidM.pdf125,Anthony,Davis,Jet Propulsion Laboratory / California Institute of Technology,"Guillaume Bal (Columbia University), Howard W. Barker (Environment Canada), David J. Diner (JPL/Caltech), Yangang Liu (DOE-BNL), Alexander Marshak (NASA-GSFC) Jeffrey S. Reid (NRL), J_me Ri_ (Universit_ille-1/LOA), Yoav Y. Schechner (Technion-IIT), Joao Teixeira (JPL/Caltech)","Gaps in Clouds, Aerosols, and Their Interactions, in the Climate System: How Can Future Satellite Remote Sensing Systems Help to Bridge Them?","The representation of clouds and of their interactions with aerosols in GCMs are dominant sources of uncertainty in predicting climate change. To address this stubborn issue, we need to map aerosol-cloud systems in 3D using carefully designed sensors in space and whole new class of algorithms to process their signals into key physical quantities.",http://surveygizmoresponseuploads.s3.amazonaws.com/fileuploads/15647/2289356/245-8f1cf1015ef5d4238eb4676cea21fcf4_DavisAnthonyB.pdf126,Joseph,Santanello,NASA-GSFC,"Aaron Boone, Paul Dirmeyer, Michael Ek, Craig Ferguson, Pierre Gentine, Benoit Guillod, Zhanqing Li, Banjamin Lintner, David Turner, Chiel van Heerwaarden, Dong Wu, Volker Wulfmeyer, Yunyan Zhang",The Importance of Routine Planetary Boundary Layer  Measurements over Land from Space,"There is an established and growing need for PBL observations over land for research in hydrology, ecology, land-atmosphere interaction, turbulence, cloud and convection processes, turbulence (e.g. large eddy simulations (LES)), and aerosol/chemistry studies as well as associated weather and climate model evaluation and development.",http://surveygizmoresponseuploads.s3.amazonaws.com/fileuploads/15647/2289356/243-a2b088763134190f4b0189a418f875ac_DS_whitepaper_PBL_final.pdf127,Steven,Greb,Wisconsin Department of Natural Resources,"Steven Greb, Simon Hook, Jay Austin, Paul DiGiacomo, Erin Hestir, ZhongPing Lee, John Lenters, John Melack, Colleen Mouw, Catherine O&#039;Reilly, Blake Schaeffer, Geoffrey Schladow, John Schott, Larry Smith, Richard Stumpf, Menghua Wang",Key Challenges for Inland Water Ecosystems,"Freshwater quality and quantity are changing in response to increasing stress from population growth and climate change. Ecosystem stressors and societal challenges include eutrophication, watershed alterations, climate change and invasive species. Space-based observations could help innumerable local inland water monitoring and management efforts.",http://surveygizmoresponseuploads.s3.amazonaws.com/fileuploads/15647/2289356/36-b93396479d290dc0fb1b0cfc711f9626_GrebStevenR.pdf128,Blake,Schaeffer,Environmental Protection Agency,Darryl Keith,US EPA perspective on integrating Earth System Science with Water Quality Research and Management,"Water quality is essential for ecological health, population health and well-being.  No current or planned earth orbiting mission is optimized for water quality measures of inland waters (lakes and reservoirs) or estuaries.  A combined science- and application- driven, long-term plan needs to replace a mission-oriented approach to address this gap.",http://surveygizmoresponseuploads.s3.amazonaws.com/fileuploads/15647/2289356/36-a51cc0b31f27ce6c310270ad6bfb5812_SchaefferBlakeA.pdf129,John,Iiames,US Environmental Protection Agency,"Kathleen Raffaele, Andrew Pilant",U.S. EPA perspective on integrating Earth System Science with Land Surface Research,"This paper addresses United States Environmental Protection Agency (EPA) operational and research challenges for the next decade in the utilization of space-based observations for the assessment of terrestrial properties affecting land, water, and air resources, and human health.",http://surveygizmoresponseuploads.s3.amazonaws.com/fileuploads/15647/2289356/66-348e4eb5007c9d0424486b5e87e0a500_IiamesJohnS.pdf130,Karen,Rosenlof,National Oceanic and Atmospheric Administration,"Amin Nehrir, Thierry Leblanc, Troy Thornberry, Dale Hurst, Richard Ferrare, Glenn Diskin",Space-Based Observations of Upper Tropospheric and Lower Stratospheric Water Vapor Profiles,"This response focuses on the near term needs for sustaining and improving observations of upper tropospheric and lower stratospheric water vapor profiles.The synergy for active and passive measurements from airborne, spaceborne, and ground based platforms is highlighted. The utility of space based water vapor profile observations is also discussed.",http://surveygizmoresponseuploads.s3.amazonaws.com/fileuploads/15647/2289356/36-4cf04f56101c32148cc73cd9eedfbb56_UTLS_Water_Vapor_Final.pdf131,Jim,Szykman,U. S. Environmental Protection Agency,Terry Keating,U.S. EPA Perspective - Key Earth System Science Challenges Related to Climate Change and Air Pollution,This is one of three responses formally provided by the EPA to the National Research Council in response to the Request For Information concerning the 2017-2027 NRC Decadal Survey in Earth Science and Applications from Space.,http://surveygizmoresponseuploads.s3.amazonaws.com/fileuploads/15647/2289356/36-c2607d4c0a3a2525c2fbc0c236369977_EPA+RFI+decadal+survey+response+Air-Climate_final.pdf132,Richard,Stumpf,NCCOS/NOS/NOAA,,Key Challenges for Inland Water Ecosystems,"Inland sources of fresh water are critical for life on our planet. Even though 50% of the world&#039;s population lives within 3 km of inland rivers and lakes, over 1.1 billion people currently do not have access to clean water (WHO, 2006). Water crises are the greatest risk facing the world today according to the World Economic Forum (WEF, 2015).",http://surveygizmoresponseuploads.s3.amazonaws.com/fileuploads/15647/2289356/183-4cc6d61a49df9c5542e8ca9ad56c0bbe_Decadal+Survey+White+paper-Key+Challenges+for+Inland+Water+Ecosystems.pdf133,Jeffrey,Privette,NOAA's National Centers for Environmental Information,Edward J. Kearns,Observing and Data System Design to Support NOAAÕs Reference Environmental Data Records,"Based on NOAA's 6-year-old Reference Environmental Data Record (formerly Climate Data Record) Program, this paper describes Reference EDR production and use, and the resulting considerations for observing and data system design.",http://surveygizmoresponseuploads.s3.amazonaws.com/fileuploads/15647/2289356/66-722edcbef64577bb09be816d8e39cd98_NCEI-Reference-EDR-White-Paper-for-NRC-Decadal-Survey-2015_FINAL.pdf134,Arnaud,Chulliat,University of Colorado Boulder and NOAA/NCEI,"Patrick Alken, Manoj C. Nair",Space-Based Observations for Geomagnetic Modeling,"We argue for the need to launch a new constellation of magnetic satellites that would build upon the knowledge acquired from recent European satellites, ensure the continuous support of enhanced navigation, resource exploration and directional drilling by research and operational models and further our understanding of geomagnetic sources.",http://surveygizmoresponseuploads.s3.amazonaws.com/fileuploads/15647/2289356/36-4e2983afa14a5261953d1b9c997080f0_ChulliatArnaud.pdf135,Lazaros,Oreopoulos,NASA's Goddard Space Flight Center,"Steven E. Platnick, Athanasios Nenes",Aerosol-Cloud Interactions: Why they continue to matter,"The white paper focuses on cloud modification by aerosols, collectively known as Aerosol-Cloud Interactions (ACI). ACI generally falls into two broad categories: cloud albedo/emissivity effects and cloud lifetime/precipitation effects. According to the last IPCC report, ACI is one of the largest uncertainties in the prediction of future climates.",http://surveygizmoresponseuploads.s3.amazonaws.com/fileuploads/15647/2289356/44-2157ab6679742deba2da1521e1dd805a_OreopoulosLazarospdf.pdf136,Sassan,Saatchi,"Jet Propulsion Laboratory, CALTECH","James Randerson (University of California, Irvine, CA) John Kimball (University of Montana, Missoula  MT) Dara Entekhabi (Massachusetts Institute of Technology, Cambridge, MA) Mahta Moghaddam (University of Southern California, Los Angeles, CA) David Schimel (Jet Propulsion Laboratory, California Institute of Technology  Pasadena, CA) Josh Fisher (Jet Propulsion Laboratory, California Institute of Technology, Pasadena, CA) Simon Yueh (Jet Propulsion Laboratory, California Institute of Technology, Pasadena, CA)",Ecosystem Response to Water Stress:  Vulnerability of Global Carbon Cycle to Extreme Climate,The response of ecosystems to water stress from increasing and persistent climate extremes is relatively unknown due to lack of systematic observations of water stress in  vegetation. We propose a spaceborne approach with high technological readiness  to measure the water profile in soil-vegetation  with high spatial and temporal resolution.,http://surveygizmoresponseuploads.s3.amazonaws.com/fileuploads/15647/2289356/36-35106edd0ce689b5704618dce31d4630_RFI_Ecosystem_Response_Stress.pdf137,David,Tobin,University of Wisconsin-Madison,"Tim Hewison, Henry Revercomb, Bruce Wielicki",Infrared Radiance Intercalibration for Climate Quality Products and Benchmarking,"Many infrared satellite radiance and derived products can be greatly improved through intercalibration with observations from a potential mission/sensor aimed at providing radiance products with unprecedented accuracy, verified using on-orbit international standards.",http://surveygizmoresponseuploads.s3.amazonaws.com/fileuploads/15647/2289356/66-c21be3b678a611d91a10dcf02cd9c243_CLARREO+White+Paper+on+IR+Intercalibration-Tobin-29Oct15.docx138,Benjamin,Smith,University of Washington Applied Physics Lab,"Kelly Brunt, Bea Csatho, Helen Fricker, Alex Gardner, Thomas Neumann",Glacier and ice sheet monitoring: Data needed for cutting edge science in the next decades,"Here we describe the need to understand changes in glaciers, ice shelves,  and ice sheets, and the data required to constrain the mechanisms driving changes in each of these systems.  We conclude that continuing altimetry, gravimetry and velocity data are needed, and that research into ice-sheet surface processes will also be of great benefit.",http://surveygizmoresponseuploads.s3.amazonaws.com/fileuploads/15647/2289356/246-14f6fb9184d2c26bfe80321a3fead912_SmithBenjaminE.pdf139,Jeffrey,Luvall,NASA Marshall Space Flight Center,"John B Malone, Professor and Director, Office of International Programs College of Veterinary Medicine, Louisiana State University. vtmalon@lsu.edu, Laine Guild, Research Scientist, NASA Ames Research Center. liane.s.guild@nasa.gov, Yvonne Walz, Researcher, Institute for Environment and Human Security, United Nations University, Bonn, Germany. walz@ehs.unu.edu,  Dale Quattrochi, Senior Research Scientist - NASA, MSFC. Dale.Quattrochi@nasa.gov, Mark Booth, Senior Lecturer, School of Medicine, Pharmacy and Health Durham University, UK, Robert Bergquist, Editor-in-Chief, Geospatial Health. robert.bergquist@outlook.com, Laura Rinaldi, President, International Society of Geospatial Health,   University of Naples. lrinaldi@unina.it, Simon Hook, Senior research Scientist, JPL simon.j.hook@jpl.nasa.gov,  Christine M Lee , Research Scientist , JPL Christine.M.Lee@jpl.nasa.gov, K.R. Turpie,  Research Associate Professor University of Maryland,Êkevin.r.turpie@nasa.gov,",Human Health/Water Quality,"Currently existing satellites do not meet the spectral, spatial, and temporal requirements to define and quantify the multi-factorial relationships among vector borne disease hosts, agents, vectors and the environment. Understanding  these relationships is critical to provide effective Public Health surveillance and response systems worldwide.",http://surveygizmoresponseuploads.s3.amazonaws.com/fileuploads/15647/2289356/243-8f5cc5c2d185866d356325adc64028a1_luvalljeffreyc.docx